今回のリレーセミナーで扱った教科書はなんですか？,今回選んだ教科書の良い・悪いと思う点と、その理由を教えてください。,今回選んだ教科書のリレーセミナーに適している・適していないと思う点と、その理由を教えてください。,今回選んだ教科書は具体的にリレーセミナーでどのように読み進めていくのが適切でしょうか？,今回選んだ教科書をスムーズに読むために必要な前提知識は何だと思いますか？
イデアル論入門  新妻 弘  近代科学社,分かりやすかった。しかし、冗長でもあった。,"それぞれが、自分で読めるのは適している点だが、行間などで議論の余地はなかったのがわるいところ
だつた。",それぞれが、いらないところを省いて読んでいくと良いと思う。,代数学の入門的知識
可換環論 松村英之 共立出版,"良い点:コンパクトにまとまっていて、流れは分かりやすかった。また、何人かで話せば行間は埋まるぐらいの難易度になっていた。
悪い点:可換環論初学でやるようなことはほとんど証明は書いていなかった。
行間も広い。",1人で読むのはしんどい本だと思う。短期集中でも読む場所を絞って完結はさせやすく、リレーセミナーにとても適していた。,第4章付値環 を目標に、事前ゼミで第1～第3章で必要なところをさらってよんだ。発表箇所の行間はできるだけ自分で埋め、どうしても埋まらない場合は、発表時に班員で話し合い、それでも埋まらなければ保留とした(話し合ったらほとんど埋まった)。,学部でやる代数学の知識は必要かも。アティマクを読んでいるとスムーズに読めた  (班員は全員アティマクを軽くではあるが読んでいた)。
"藤田宏・黒田成俊・伊藤清三
『関数解析』，岩波書店","良い点：記述が丁寧で行間が比較的少ない，物理的応用を見据えた構成に
なっている
悪い点：絶版で中古価格も高騰しており入手しづらい，行間の広い箇所が僅かだが散見される",基本的には同上．RS で使う上での良い点として，構造が割と細かく分けられているので，分担を決めやすいことがある．,"1〜3 章 (ノルム空間，Banach 空間などの話題)を予習 or 事前ゼミに回し，RS では 4 章 (Hilbert空間の話題) を扱うのがよいと思う．
行間は比較的少ないので，教科書の記述に沿って進めつつ，必要に応じて各自で別の文献を参照す
る形が適当だと感じた．",線型空間，集合・位相 (ジェネトポ)， Lebesgue 積分
松岡正浩『量子光学』裳華房,量子光学という目標に向かって必要となる光学の基礎的な内容もしっかり書いてありこれ1冊で未習から量子光学を学ぶ段階までたどり着ける,演習問題がない点は適していない,現象と数式を対応させていく点が大事かつ難しいポイントだったので所々不明瞭な部分を議論したのは良かった。,マクスウェル方程式を使った電磁気学、解析力学の基礎
,,,,
田崎統計力学,"文が長く読むのがしんどい。
論理飛躍はそこまで大きくなかった",同上,一人1章で問題ないが、4章は全員読んでおくのが良い,量子力学、解析力学
,,,,
量子情報科学入門・石坂智他,ある程度章立てが独立しておりたとえば,同上,細かい計算を飛ばしつつもある程度の線形代数,基礎的な線形代数(B1でやる程度)、量子
,"2,3章を飛ばして4,5章をやるといったこ",演習問題の答えが載っており、行間で困ることがそ,の知識をフォローすればかなり読み進めることが,論の基礎(ただ1章とかでフォローは可能)
,とが出来るのでとてもやりやすい。,こまでない,できる。,
,,,,
"イデアル論入門編・新妻弘・近
代科学社","丁寧で初心者向けです。わかっている
人からすると煩雑かもしれません。",同上,"適当にワンセクションぐらいで分担すればいいと思
います。",素朴集合論、群論、初歩的な環論
量子力学10講・谷村省吾・名古屋大学出版会,"良い点
典型的な古典的な量子力学からスタートするのではなく、線型代数をベースにした内容であること
悪い点
時々説明が雑で困った","適した点
量子力学の初学者の集まりであり、まだゼミ経験のないメンバーも多く、ページ数も多くはなく内容の難しさも適度であったため
適してない点は特にない","一章につき1人から2人程度で読むのが良い
序盤は、線型代数の知識をしっかり議論すると今後の議論に重要な知識をしっかりと入れられそう",学部一年程度の線型代数
須藤・一般相対論入門,"良い点は実際に行う計算のアウトラインを書いて薄いながらも重力波の計算まで行われており、さらに筆者の物理観がひしひしと伝わってくるような書き方で良かった。
悪い点は計算が省略されすぎたり、細かい議論が省かれている部分が多かった。(シュワルツシルト解の導出など)","適した点は首尾よくまとめられた教科書であるので、細かい部分を気にしなければ論理関係が明白で発表しやすかった。
悪い点はしっかり自分の手で全て計算しようとするとかなり酷い計算を行うので難しかったところ。",3章の測地線の定式化、4章の変分原理からアインシュタイン方程式を導くところが面白い。(問題の難易度も高くて面白そう。),大学1年の教養の微積分
J.J.Sakurai現代の量子力学 (下),発展的な内容が纏まっている誤植が多い,量が多いため、RSで全部をさわれない,事前事後のゼミを加え、リレーセミナーでは全体的な基礎となる部分を触ればよい,上巻を既習であること。オムニバスだと基礎知識が多くなって厳しいと思う。
理論電磁気学  砂川重信  紀伊國屋書店,本格的な内容をすっきりと学べる。一方で少し具体例が重い。,本格的に学ぶのには適していたが、リレーセミナーという短い期間で扱うのには適していなかった。,3章までを事前ゼミで終わらせて、4章以降の具体的な内容を絞って進めていくのが適切だと感じている。,特にない。
統計力学1  田崎晴明  培風館,"文章が長いので読みにくい。簡潔にまとまったものがほしい。
具体例や計算が豊富なので、統計力学
がどんな分野なのか雰囲気を知れる","初学者にやさしい。
3人だと全然進まない",初学者なら統計力学の基礎にしぼって読むか、統計力学をやったことあるひとなら具体例の章を分担して読むか,解析力学、電磁気学、など学部2年の物理学科の知識
Abelian Varieties,"良い：アーベル多様体について知っておくべき基礎が全て書いてある。
悪い：spmで読む本ではなかった。アーベル多様体ではなく代数幾何のファクトの証明がまああった。そもそもマン
フォードが教科書書くの下手","適している：内容はそこまで多くない
適していない：無駄に系が多い。必要最低限のラインがわかりにくい。",選ばない。Advでやれ。,スキーム論 コホモロジー
曲線と曲面の微分幾何・小林昭七・裳華房,"良い点
・図や具体例が多い
・演習問題に回答がついている悪い点
・微分形式や接ベクトルの定義が曖昧に感じた(多様体を定義してないため仕方ないかもしれない)ので厳密にやりた
い人には向いてないかも","適している点
・ほどよく行間がある","1章〜2章の最初を事前ゼミ、そこから3章の最後までをRSでやりましたがちょうど良かったと思います。
3章の最後(測地線)が結構難しかったです。
1章のFenchelの定理もなかなかイメージを文章から正しく読み取るのが難しかったように思いまし
た。",B1レベルの微分積分、線形代数
流体力学  巽友正  培風館,良い・一般論、基礎方程式の導出が最初に書かれているため分野の概要が割と早い段階で掴めるということと各定理に対して例が載っていて分かりやすかった。,適している。前述のように各定理に例が載っているためその定理の別側面について考察しやすくなっているのでリレーセミナーでの発表が教科書の読み上げになりにくい。,"前述のようにリレーセミナーにおいて適している部分は第2章以降のため第1章は予習か事前ゼミのほうが良い。行間の広さは6節水の流れの非線形現象周りがだいぶ広かったがそれ以外は行間は
少ない方だと感じた。",基本的な複素関数論、偏微分方程式
トポロジーの基礎・河澄響矢,"○行間がない、一般論から書いていて良い付録が充実していた
△図が少ない、気持ちの説明が少ない",同上,証明よりも具体例を扱うイメージを自分たちで補う,位相空間論と群論の初歩細かい圏論に馴染みがある方が良い
Basic Category Theory,圏論の中ではかなり初歩的なところを,,,
TOM LEINSTER,扱ってくれ、初学者にとってベストだと思,,,特にないが、集合論の素養が必要。また、
ArXivに落ちてます。日本語訳,われました。しかし、少しいい加減な記,同上,通常通り,具体例(特に代数)を多く知っているとわか
は丸善出版で、それを使って,述があり、悩む場面がいくつかありまし,,,りやすいと思いました。
いる人もいました。,た。concepts of dual という表現など。,,,
"リー群と表現論,小林俊之・大島利雄,岩波書店","良:さまざまな分野が書かれていて目的に沿って読むところを選べる
悪:分厚い&重い",同上,今回は3章の関数解析よりのところを扱ったが、関数解析の事実を認めれば行間はそこまで無かったように感じた。指標の偉さが身に染みた。,位相群の話を取り扱ったので、線形代数・多少の群論・多少の位相空間論・多少の関数解析
"Quantum field theory, mark srednicki, Cambridge","良い点
はじめの方は行間が少なく、英語が平易で読みやすい
悪い点
だんだんと行間がデカくなる","適している点
はじめの行間は少なく、章分けも細かいので回しやすかった
適していない点
進むにつれて良くわからない記述もあり、強い人がいないと回らなくなりそう",ファインマンダイアグラムが現れるところが読み甲斐あった。それ以降は難しかった,量子力学、解析力学、特殊相対論
非平衡系の統計力学・北原和夫・岩波基礎物理シリーズ,"良い点
一般的な非平衡系統計力学の教科書と流れが異なり、流体力学の非平衡系への拡張から始まる。非平衡系への新たなアプローチを知ることができる。
悪い点
誤植が多い。また、一般的な非平衡統計力学の話が４章以降から始まるた
め、それまでに期待外れ感を抱く人はい
そう。","適している点
誤植が多く、また行間もちょうどよくある。考えさせられる文章で、内容に関して議論しやすい。
適していない点なし",途中計算を丁寧に追っていくスタイルが良いと思われる。,熱力学、統計力学は必須。流体力学、解析力学はあるとスムーズ。
"SGC173 一歩進んだ理解を目指す物性物理学講義
加藤岳生 著サイエンス社","物性物理学の主要トピックの概要がコンパクトにまとまっているのが良い．
ところどころ難しすぎる部分がガッツリ飛ばされているので，行間を埋めたい場合はその箇所を他の本をしっかり読ん で補う必要がある．",初学者でも事前ゼミをすれば7章の超伝導までRSで読むことができる程度によくまとまっているので，初学だが超伝導をやってみたい人には向いている． ただ，概説するために難しすぎる箇所は飛ばしているため，埋まらない行間がある．,"7章の超伝導の章．
難しいところは飛ばしながらではあるが，BCS理論とGL理論を扱い，Meissner効果や第一種，第二種超伝導体の臨界磁場の導出など，超伝導でよく聞く現象について式を通した理解ができる．
行間があるので，余力があれば他の本を使ったりして知らない知識を共有できて良いと思う．
また，第二量子化を用いた記述になっているので素粒子の場の理論をやっている人はそれとのつながりを話すと面白い．","量子力学，統計力学．
場の理論の初歩を少しやったことがあれば，第二量子化の記述がわかりやすい．"
"代数幾何学入門: 代数学の基
礎を出発点として•永井保成•森北出版",トピックが良い。良いところでもあるが、説明がながい。,,予習なしで読む。,特になし。
,,,,
,,,,
,,,,
『基幹講座  物理学  解析力学』・畑浩之・東京図書,"厚くはないが非常に勉強になって良い。内容が省略されて行間が広過ぎると感じるところもあって真面目に読むのはやや負担が大き過ぎると感じた。また、9章の微分形式が凝縮され過ぎていて初学の場合これだけだとかなり厳しい。
同著者の問題集等も使用して補わないと自力",,上にも書いたが行間が広過ぎるところが所々ある。9章の微分形式は挫折しやすそう。,学部教養程度の微分積分、一部複素解析（留数定理を用いた積分）
,,,,
,,レーセミナーで読む意味は乏しい。,,
,,,,
,,,,
,,,,
"①鳥谷部祥一『生物物理学』、日本評論社
②望月敦史『理論生物学概論』、共立出版","①良い点：物理の人間ではあまり持ってない化学平衡や力学系の内容を書いてくれている。章ごとがほどよく独立していて読みたいところだけ読める。
悪い点：文章が冗長。誤植も数か所あった。生物の知識が無いと難しく感じる。
②良い点：生物学の立場から数理モデルを紹介してる。
悪い点：数学の知識が無いと難しい。",両者ともほぼオムニバス形式で扱ったのだが、押さえる所を押さえておけば各論的に読めるので、適していると思う。,各自が読みたい所を読むスタイルで上手く行ったので、これがいいと思う。,熱力学と簡単な生化学の知識(高校の生物基礎ぐらい)
統計力学I・田崎晴明・培風館非平衡統計力学・沙川貴大・共立出版,"田崎統計Iは読みやすかった。悪い点は思い浮かばなかった。
沙川非平衡統計力学は薄いが、巻末付録数式行間を追っていると思っていたより時間がかかってしまった()",章によって重さが違うのだが、機械的に章ごとに割り振ってしまい発表時間に偏りがでてしまった。,各章ごとの重さを事前にチェックしておく。,熱力学、量子力学
『代数的トポロジー』，枡田幹也，朝倉書店,"単体複体のホモロジー，特異ホモロ
ジー，胞体複体のホモロジー，特異コホモロジーなど幅広く解説されている点が良いと感じました．一方で，代数的(群論
・ホモロジー代数的)な解説が不足気味であると感じました．",河澄先生の本と比べると難易度は低いように(個人的には)感じ，また幾何学的なイメージについても随所で述べられており楽しく読める点がよいと感じました．一方で，やはり代数的な説明が不足していることから，代数的な面について別の本を副読本として読んだ方がより理解が深まるという点はやや不満な点としてあげられると思いました．,"今回は単体複体のホモロジー，特異ホモロジー，胞体複体のホモロジー，特異コホモロジーをそれぞれ1人ずつが担当する形でセミナーを行いまし た．これだとやや量が多く終わり切らなかった部分がありますが，代数トポロジーについて広く学べるのでよいと思いました．胞体複体やコホモロジーは長くて難解な証明が多いため，難易度が高いと感じました．こうした点について班員の知識レベルも加味しながら担当範囲を決めるのが良いと思いま
す．",群論は前提知識になると感じました
